{
  "schema_version": "1",
  "contract_version": "1",
  "projection_status": "current",
  "generated_at": "2026-07-12T12:00:00.000Z",
  "generation": 7,
  "workspace": {
    "format_version": "1",
    "status": "ready"
  },
  "delivery": {
    "kind": "goal",
    "id": "g22-vsp-distribution-contract",
    "status": "executing",
    "revision": 0
  },
  "continuation": {
    "available": true,
    "safe_resume_command": "/hw:resume"
  },
  "invalidation": null
}
